{
  "attempt_id": "pilot-moons-a001",
  "attempt_number": 1,
  "bundle_id": "b-9a39b70665ba909edb8abc13",
  "campaign_id": "ema-schedule-v1",
  "command": [
    ".venv/bin/python",
    "study/runner.py",
    "--dataset",
    "moons",
    "--seed",
    "71",
    "--phase",
    "pilot",
    "--policy",
    "cosine",
    "--duration",
    "10000",
    "--stop",
    "1500",
    "--device",
    "mps",
    "--attempt-id",
    "pilot-moons-a001"
  ],
  "data_revision": "290f33e0fdf388a2a4d58e7b97b7cbb639046d8b4c951accabd3c97912fa453a",
  "ended_at": "2026-10-08T03:25:22.118952+00:00",
  "environment": {
    "broker": "common local-process",
    "device_requested": "mps",
    "dtype": "float32"
  },
  "error": {
    "kind": "timed_out",
    "message": "See retained broker receipt and stderr; this attempt is excluded from confirmation."
  },
  "exit_code": -15,
  "experiment_id": "moons-71-cosine-10000",
  "inputs": [
    {
      "media_type": "application/json",
      "path": "artifacts/pilot/moons-71/cosine-10000/attempts/pilot-moons-a001/input.json",
      "retention": "retained",
      "sha256": "290f33e0fdf388a2a4d58e7b97b7cbb639046d8b4c951accabd3c97912fa453a"
    },
    {
      "media_type": "application/json",
      "path": "artifacts/pilot/moons-71/cosine-10000/attempts/pilot-moons-a001/started.json",
      "retention": "retained",
      "sha256": "070568c89f2258ea5e1ab3f861ffc2c798693735be7d64940c1eb0e6cedba22c"
    },
    {
      "media_type": "application/json",
      "path": ".compute/requests/ff35db4da89a4fe4b4aa89d99e42778c.json",
      "retention": "retained",
      "sha256": "dba1ebe683fbc0751eef6996836152dbea9103d2dfad2a57bbd9b0a48bd14cc8"
    }
  ],
  "model_revision": "f1e0d6bbbb67448b651afa7a78566c9be1814a0b30fbe822885d1881efd273a7",
  "outputs": [
    {
      "media_type": "application/json",
      "path": "artifacts/pilot/moons-71/cosine-10000/attempts/pilot-moons-a001/input.json",
      "retention": "retained",
      "sha256": "290f33e0fdf388a2a4d58e7b97b7cbb639046d8b4c951accabd3c97912fa453a"
    },
    {
      "media_type": "application/json",
      "path": "artifacts/pilot/moons-71/cosine-10000/attempts/pilot-moons-a001/started.json",
      "retention": "retained",
      "sha256": "070568c89f2258ea5e1ab3f861ffc2c798693735be7d64940c1eb0e6cedba22c"
    },
    {
      "media_type": "application/json",
      "path": ".compute/responses/ff35db4da89a4fe4b4aa89d99e42778c.json",
      "retention": "retained",
      "sha256": "254f13fb0724f7c9f24930bab550d957e088331ebd50ab6f83d95090349e7202"
    }
  ],
  "protocol_revision": "v1",
  "record_type": "RunRecord",
  "run_id": "cosine-10000-pilot",
  "schema_version": "0.2",
  "split": "pilot",
  "started_at": "2026-10-08T03:25:20.623356+00:00",
  "status": "interrupted",
  "usage": {
    "money_usd": 0,
    "tokens": 0,
    "wall_seconds": 1.530519291991368
  }
}
